{
  "accession": "MWB-SYN-007",
  "assay_platform": "targeted LC-MS",
  "biospecimen_timing": "pre and post acute cycling",
  "data_availability": "public",
  "documented_absent_modalities": [
    "genetics"
  ],
  "has_codebook": true,
  "has_data_files": true,
  "has_metadata": true,
  "mirage_flags": [],
  "modalities": [
    "metabolomics",
    "exercise",
    "cpet",
    "body_composition"
  ],
  "provenance": {
    "row_key": "SYN-CPET-RICH::Metabolomics Workbench::MWB-SYN-007::row-8",
    "source": "data/examples/mock_repository_records.csv",
    "source_row_number": 8
  },
  "repository": "Metabolomics Workbench",
  "sample_matrix": "plasma",
  "sample_size": 150,
  "study_id": "SYN-CPET-RICH"
}
