{
  "accession": "MWB-SYN-006",
  "assay_platform": "GC-MS serum metabolomics",
  "biospecimen_timing": "baseline fasting",
  "data_availability": "public",
  "documented_absent_modalities": [
    "genetics"
  ],
  "has_codebook": false,
  "has_data_files": true,
  "has_metadata": true,
  "mirage_flags": [
    "no_variable_dictionary_or_codebook"
  ],
  "modalities": [
    "metabolomics"
  ],
  "provenance": {
    "row_key": "SYN-MET-NOCODEBOOK",
    "source": "data/examples/mock_repository_records.csv"
  },
  "repository": "Metabolomics Workbench",
  "sample_matrix": "serum",
  "sample_size": 95,
  "study_id": "SYN-MET-NOCODEBOOK"
}
