{
  "accession": "MWB-SYN-001",
  "assay_platform": "LC-MS plasma metabolomics",
  "biospecimen_timing": "pre and post 12-week training",
  "data_availability": "public",
  "documented_absent_modalities": [],
  "has_codebook": true,
  "has_data_files": true,
  "has_metadata": true,
  "mirage_flags": [],
  "modalities": [
    "metabolomics",
    "exercise",
    "genetics",
    "cpet",
    "body_composition",
    "diet"
  ],
  "provenance": {
    "row_key": "SYN-METEX-GEN::Metabolomics Workbench::MWB-SYN-001::row-2",
    "source": "data/examples/mock_repository_records.csv",
    "source_row_number": 2
  },
  "repository": "Metabolomics Workbench",
  "sample_matrix": "plasma",
  "sample_size": 180,
  "study_id": "SYN-METEX-GEN"
}
