{
  "accession": "MWB-SYN-002",
  "assay_platform": "untargeted LC-MS",
  "biospecimen_timing": "fasting morning draw linked to 7-day actigraphy",
  "data_availability": "public",
  "documented_absent_modalities": [
    "genetics"
  ],
  "has_codebook": true,
  "has_data_files": true,
  "has_metadata": true,
  "mirage_flags": [],
  "modalities": [
    "metabolomics",
    "actigraphy",
    "body_composition"
  ],
  "provenance": {
    "row_key": "SYN-ACTI-MET::Metabolomics Workbench::MWB-SYN-002::row-3",
    "source": "data/examples/mock_repository_records.csv",
    "source_row_number": 3
  },
  "repository": "Metabolomics Workbench",
  "sample_matrix": "plasma",
  "sample_size": 240,
  "study_id": "SYN-ACTI-MET"
}
