{
  "accession": "DBGAP-SYN-003",
  "assay_platform": "NMR metabolomics",
  "biospecimen_timing": "baseline fasting",
  "data_availability": "restricted_metadata_only",
  "documented_absent_modalities": [],
  "has_codebook": true,
  "has_data_files": false,
  "has_metadata": true,
  "mirage_flags": [
    "no_data_files"
  ],
  "modalities": [
    "metabolomics",
    "genetics",
    "diet"
  ],
  "provenance": {
    "row_key": "SYN-OMICS-GEN",
    "source": "data/examples/mock_repository_records.csv"
  },
  "repository": "dbGaP",
  "sample_matrix": "serum",
  "sample_size": 1200,
  "study_id": "SYN-OMICS-GEN"
}
