{
  "accession": "not_available",
  "assay_platform": "unknown",
  "biospecimen_timing": "unknown",
  "data_availability": "not_available",
  "documented_absent_modalities": [],
  "has_codebook": false,
  "has_data_files": false,
  "has_metadata": false,
  "mirage_flags": [
    "no_repository_accession",
    "repository_data_not_available",
    "no_downloadable_metadata",
    "no_variable_dictionary_or_codebook",
    "no_data_files",
    "unclear_assay_platform",
    "unclear_biospecimen_timing"
  ],
  "modalities": [
    "metabolomics",
    "exercise",
    "cpet"
  ],
  "provenance": {
    "row_key": "SYN-EXER-NODATA::unknown::not_available::row-5",
    "source": "data/examples/mock_repository_records.csv",
    "source_row_number": 5
  },
  "repository": "unknown",
  "sample_matrix": "unknown",
  "sample_size": 64,
  "study_id": "SYN-EXER-NODATA"
}
